{
  "$schema": "https://json-schema.org/draft/2020-12/schema",
  "$id": "FacilitySettings.json",
  "title": "FacilitySettings",
  "type": "array",
  "items": {
    "type": "object",
    "properties": {
      "Id": {
        "type": "integer",
        "minimum": 20001,
        "maximum": 20704
      },
      "Name": {
        "type": "string",
        "minLength": 3,
        "maxLength": 5
      },
      "Level": {
        "type": "integer",
        "minimum": 1,
        "maximum": 9,
        "enum": [
          1,
          2,
          3,
          4,
          5,
          6,
          7,
          8,
          9
        ]
      },
      "Type": {
        "type": "integer",
        "minimum": 1,
        "maximum": 8,
        "enum": [
          1,
          2,
          3,
          4,
          5,
          6,
          7,
          8
        ]
      },
      "UnlockArmy": {
        "type": "array",
        "minItems": 0,
        "maxItems": 3
      },
      "UnlockArmyType": {
        "type": "array",
        "minItems": 0,
        "maxItems": 3
      },
      "CityRecovery": {
        "type": "integer",
        "minimum": 0,
        "maximum": 4,
        "enum": [
          0,
          4
        ]
      },
      "ArmyRecovery": {
        "type": "integer",
        "minimum": 0,
        "maximum": 16,
        "enum": [
          0,
          4,
          8,
          12,
          16
        ]
      },
      "ProduceMoney": {
        "type": "integer",
        "minimum": 0,
        "maximum": 120,
        "enum": [
          0,
          16,
          30,
          45,
          60,
          80,
          90,
          100,
          110,
          120
        ]
      },
      "ProduceGear": {
        "type": "integer",
        "minimum": 0,
        "maximum": 20,
        "enum": [
          0,
          5,
          10,
          15,
          20
        ]
      },
      "ProduceAtomic": {
        "type": "integer",
        "minimum": 0,
        "maximum": 14,
        "enum": [
          0,
          2,
          4,
          8,
          14
        ]
      },
      "CostMoney": {
        "type": "integer",
        "minimum": 0,
        "maximum": 360,
        "enum": [
          0,
          60,
          90,
          100,
          120,
          125,
          130,
          140,
          150,
          160,
          170,
          175,
          180,
          190,
          200,
          230,
          240,
          280,
          320,
          360
        ]
      },
      "CostGear": {
        "type": "integer",
        "minimum": 0,
        "maximum": 180,
        "enum": [
          0,
          10,
          15,
          20,
          25,
          30,
          40,
          45,
          50,
          55,
          60,
          70,
          90,
          100,
          120,
          160,
          180
        ]
      },
      "CostAtomic": {
        "type": "integer",
        "minimum": 0,
        "maximum": 30,
        "enum": [
          0,
          1,
          2,
          4,
          7,
          8,
          10,
          12,
          18,
          24,
          30
        ]
      },
      "Only": {
        "type": "integer",
        "minimum": 0,
        "maximum": 1,
        "enum": [
          0,
          1
        ]
      }
    },
    "required": [
      "Id",
      "Name",
      "Level",
      "Type",
      "UnlockArmy",
      "UnlockArmyType",
      "CityRecovery",
      "ArmyRecovery",
      "ProduceMoney",
      "ProduceGear",
      "ProduceAtomic",
      "CostMoney",
      "CostGear",
      "CostAtomic",
      "Only"
    ],
    "additionalProperties": false
  }
}
